{
  "schema_version": "1.0",
  "project": "F&B 프랜차이즈 본사 7부서 매뉴얼",
  "created_at": "2026-05-07T00:00:00",
  "last_updated": "2026-06-20T00:00:00",
  "stats": {
    "total": 44,
    "done": 41,
    "in_progress": 0,
    "eval_pending": 0,
    "rework": 0,
    "pending": 3,
    "failed": 0
  },
  "generators": [
    {
      "id": "sop-writer-1",
      "dept": "해산물물류",
      "task_count": 7
    },
    {
      "id": "sop-writer-2",
      "dept": "조리",
      "task_count": 8
    },
    {
      "id": "sop-writer-3",
      "dept": "홀서비스",
      "task_count": 6
    },
    {
      "id": "sop-writer-4",
      "dept": "가맹운영지원",
      "task_count": 7
    },
    {
      "id": "sop-writer-5",
      "dept": "마케팅",
      "task_count": 5
    },
    {
      "id": "sop-writer-6",
      "dept": "인사교육",
      "task_count": 6
    },
    {
      "id": "sop-writer-7",
      "dept": "재무정산",
      "task_count": 5
    }
  ],
  "tasks": [
    {
      "id": "T001",
      "dept": "해산물물류",
      "chapter": "Ch01",
      "title": "입고검수",
      "status": "pending",
      "assigned_to": "sop-writer-1",
      "depends_on": [],
      "eval_status": null,
      "output_file": "chapters/해산물물류/Ch01_입고검수.md",
      "created_at": "2026-05-07T00:00:00",
      "updated_at": "2026-06-20T00:00:00"
    },
    {
      "id": "T002",
      "dept": "해산물물류",
      "chapter": "Ch02",
      "title": "보관",
      "status": "pending",
      "assigned_to": "sop-writer-1",
      "depends_on": [
        "T001"
      ],
      "eval_status": null,
      "output_file": "chapters/해산물물류/Ch02_보관.md",
      "created_at": "2026-05-07T00:00:00",
      "updated_at": "2026-06-20T00:00:00"
    },
    {
      "id": "T003",
      "dept": "해산물물류",
      "chapter": "Ch03",
      "title": "출고",
      "status": "pending",
      "assigned_to": "sop-writer-1",
      "depends_on": [
        "T002"
      ],
      "eval_status": null,
      "output_file": "chapters/해산물물류/Ch03_출고.md",
      "created_at": "2026-05-07T00:00:00",
      "updated_at": "2026-06-20T00:00:00"
    },
    {
      "id": "T004",
      "dept": "해산물물류",
      "chapter": "Ch04",
      "title": "재고관리",
      "status": "done",
      "assigned_to": "sop-writer-1",
      "depends_on": [
        "T003"
      ],
      "eval_status": "pass",
      "output_file": "chapters/해산물물류/Ch04_재고관리.md",
      "created_at": "2026-05-07T00:00:00",
      "updated_at": "2026-05-07T12:30:00"
    },
    {
      "id": "T005",
      "dept": "해산물물류",
      "chapter": "Ch05",
      "title": "긴급대응",
      "status": "done",
      "assigned_to": "sop-writer-1",
      "depends_on": [
        "T004"
      ],
      "eval_status": "pass",
      "output_file": "chapters/해산물물류/Ch05_긴급대응.md",
      "created_at": "2026-05-07T00:00:00",
      "updated_at": "2026-05-07T14:30:00"
    },
    {
      "id": "T006",
      "dept": "해산물물류",
      "chapter": "Ch06",
      "title": "공급사관리",
      "status": "done",
      "assigned_to": "sop-writer-1",
      "depends_on": [
        "T005"
      ],
      "eval_status": "pass",
      "output_file": "chapters/해산물물류/Ch06_공급사관리.md",
      "created_at": "2026-05-07T00:00:00",
      "updated_at": "2026-05-07T16:30:00"
    },
    {
      "id": "T007",
      "dept": "해산물물류",
      "chapter": "Ch07",
      "title": "품질관리",
      "status": "done",
      "assigned_to": "sop-writer-1",
      "depends_on": [
        "T006"
      ],
      "eval_status": "pass",
      "output_file": "chapters/해산물물류/Ch07_품질관리.md",
      "created_at": "2026-05-07T00:00:00",
      "updated_at": "2026-05-07T18:30:00"
    },
    {
      "id": "T008",
      "dept": "조리",
      "chapter": "Ch01",
      "title": "메뉴SOP",
      "status": "done",
      "assigned_to": "sop-writer-2",
      "depends_on": [],
      "eval_status": "pass",
      "output_file": "chapters/조리/Ch01_메뉴SOP.md",
      "created_at": "2026-05-07T00:00:00",
      "updated_at": "2026-05-07T12:30:00"
    },
    {
      "id": "T009",
      "dept": "조리",
      "chapter": "Ch02",
      "title": "위생관리",
      "status": "done",
      "assigned_to": "sop-writer-2",
      "depends_on": [
        "T008"
      ],
      "eval_status": "pass",
      "output_file": "chapters/조리/Ch02_위생관리.md",
      "created_at": "2026-05-07T00:00:00",
      "updated_at": "2026-05-07T14:30:00"
    },
    {
      "id": "T010",
      "dept": "조리",
      "chapter": "Ch03",
      "title": "식자재관리",
      "status": "done",
      "assigned_to": "sop-writer-2",
      "depends_on": [
        "T009"
      ],
      "eval_status": "pass",
      "output_file": "chapters/조리/Ch03_식자재관리.md",
      "created_at": "2026-05-07T00:00:00",
      "updated_at": "2026-05-07T16:30:00"
    },
    {
      "id": "T011",
      "dept": "조리",
      "chapter": "Ch04",
      "title": "조리장비",
      "status": "done",
      "assigned_to": "sop-writer-2",
      "depends_on": [
        "T010"
      ],
      "eval_status": "pass",
      "output_file": "chapters/조리/Ch04_조리장비.md",
      "created_at": "2026-05-07T00:00:00",
      "updated_at": "2026-05-07T18:30:00"
    },
    {
      "id": "T012",
      "dept": "조리",
      "chapter": "Ch05",
      "title": "주방동선",
      "status": "done",
      "assigned_to": "sop-writer-2",
      "depends_on": [
        "T011"
      ],
      "eval_status": "pass",
      "output_file": "chapters/조리/Ch05_주방동선.md",
      "created_at": "2026-05-07T00:00:00",
      "updated_at": "2026-05-07T20:30:00"
    },
    {
      "id": "T013",
      "dept": "조리",
      "chapter": "Ch06",
      "title": "조리교육",
      "status": "done",
      "assigned_to": "sop-writer-2",
      "depends_on": [
        "T012"
      ],
      "eval_status": "pass",
      "output_file": "chapters/조리/Ch06_조리교육.md",
      "created_at": "2026-05-07T00:00:00",
      "updated_at": "2026-05-07T22:30:00"
    },
    {
      "id": "T014",
      "dept": "조리",
      "chapter": "Ch07",
      "title": "메뉴개발",
      "status": "done",
      "assigned_to": "sop-writer-2",
      "depends_on": [
        "T013"
      ],
      "eval_status": "pass",
      "output_file": "chapters/조리/Ch07_메뉴개발.md",
      "created_at": "2026-05-07T00:00:00",
      "updated_at": "2026-05-08T00:30:00"
    },
    {
      "id": "T015",
      "dept": "조리",
      "chapter": "Ch08",
      "title": "표준레시피",
      "status": "done",
      "assigned_to": "sop-writer-2",
      "depends_on": [
        "T014"
      ],
      "eval_status": "pass",
      "output_file": "chapters/조리/Ch08_표준레시피.md",
      "created_at": "2026-05-07T00:00:00",
      "updated_at": "2026-05-08T02:30:00"
    },
    {
      "id": "T016",
      "dept": "홀서비스",
      "chapter": "Ch01",
      "title": "응대표준",
      "status": "done",
      "assigned_to": "sop-writer-3",
      "depends_on": [],
      "eval_status": "pass",
      "output_file": "chapters/홀서비스/Ch01_응대표준.md",
      "created_at": "2026-05-07T00:00:00",
      "updated_at": "2026-05-07T12:30:00"
    },
    {
      "id": "T017",
      "dept": "홀서비스",
      "chapter": "Ch02",
      "title": "클레임처리",
      "status": "done",
      "assigned_to": "sop-writer-3",
      "depends_on": [
        "T016"
      ],
      "eval_status": "pass",
      "output_file": "chapters/홀서비스/Ch02_클레임처리.md",
      "created_at": "2026-05-07T00:00:00",
      "updated_at": "2026-05-07T14:30:00"
    },
    {
      "id": "T018",
      "dept": "홀서비스",
      "chapter": "Ch03",
      "title": "테이블운영",
      "status": "done",
      "assigned_to": "sop-writer-3",
      "depends_on": [
        "T017"
      ],
      "eval_status": "pass",
      "output_file": "chapters/홀서비스/Ch03_테이블운영.md",
      "created_at": "2026-05-07T00:00:00",
      "updated_at": "2026-05-07T16:30:00"
    },
    {
      "id": "T019",
      "dept": "홀서비스",
      "chapter": "Ch04",
      "title": "주문관리",
      "status": "done",
      "assigned_to": "sop-writer-3",
      "depends_on": [
        "T018"
      ],
      "eval_status": "pass",
      "output_file": "chapters/홀서비스/Ch04_주문관리.md",
      "created_at": "2026-05-07T00:00:00",
      "updated_at": "2026-05-07T18:30:00"
    },
    {
      "id": "T020",
      "dept": "홀서비스",
      "chapter": "Ch05",
      "title": "회계",
      "status": "done",
      "assigned_to": "sop-writer-3",
      "depends_on": [
        "T019"
      ],
      "eval_status": "pass",
      "output_file": "chapters/홀서비스/Ch05_회계.md",
      "created_at": "2026-05-07T00:00:00",
      "updated_at": "2026-05-07T20:30:00"
    },
    {
      "id": "T021",
      "dept": "홀서비스",
      "chapter": "Ch06",
      "title": "위생청소",
      "status": "done",
      "assigned_to": "sop-writer-3",
      "depends_on": [
        "T020"
      ],
      "eval_status": "pass",
      "output_file": "chapters/홀서비스/Ch06_위생청소.md",
      "created_at": "2026-05-07T00:00:00",
      "updated_at": "2026-05-07T22:30:00"
    },
    {
      "id": "T022",
      "dept": "가맹운영지원",
      "chapter": "Ch01",
      "title": "OPEN프로세스",
      "status": "done",
      "assigned_to": "sop-writer-4",
      "depends_on": [],
      "eval_status": "pass",
      "output_file": "chapters/가맹운영지원/Ch01_OPEN프로세스.md",
      "created_at": "2026-05-07T00:00:00",
      "updated_at": "2026-05-07T12:30:00"
    },
    {
      "id": "T023",
      "dept": "가맹운영지원",
      "chapter": "Ch02",
      "title": "슈퍼바이징",
      "status": "done",
      "assigned_to": "sop-writer-4",
      "depends_on": [
        "T022"
      ],
      "eval_status": "pass",
      "output_file": "chapters/가맹운영지원/Ch02_슈퍼바이징.md",
      "created_at": "2026-05-07T00:00:00",
      "updated_at": "2026-05-07T14:30:00"
    },
    {
      "id": "T024",
      "dept": "가맹운영지원",
      "chapter": "Ch03",
      "title": "QSC점검",
      "status": "done",
      "assigned_to": "sop-writer-4",
      "depends_on": [
        "T023"
      ],
      "eval_status": "pass",
      "output_file": "chapters/가맹운영지원/Ch03_QSC점검.md",
      "created_at": "2026-05-07T00:00:00",
      "updated_at": "2026-05-07T16:30:00"
    },
    {
      "id": "T025",
      "dept": "가맹운영지원",
      "chapter": "Ch04",
      "title": "교육지원",
      "status": "done",